<skin xmlns="http://jorgan.sourceforge.net/skin" xmlns:xsi="http://www.w3.org/2001/XMLSchema-instance"
	xsi:schemaLocation="http://jorgan.sourceforge.net/skin ../../jorgan-gui/src/main/xml/skin.xsd">
  <name>theatre</name>
  <styles>
    <style>
      <anchor>CENTER</anchor>
      <fill>NONE</fill>
      <width>0</width>
      <height>0</height>
      <padding>
        <top>0</top>
        <left>0</left>
        <bottom>0</bottom>
        <right>0</right>
      </padding>
      <layers>
        <image>
          <anchor>CENTER</anchor>
          <fill>NONE</fill>
          <width>0</width>
          <height>0</height>
          <padding>
            <top>0</top>
            <left>0</left>
            <bottom>0</bottom>
            <right>0</right>
          </padding>
          <file>console.png</file>
          <border>
            <top>0</top>
            <left>0</left>
            <bottom>0</bottom>
            <right>0</right>
          </border>
        </image>
      </layers>
      <name>console</name>
    </style>
    <style>
      <anchor>CENTER</anchor>
      <fill>NONE</fill>
      <width>0</width>
      <height>0</height>
      <padding>
        <top>0</top>
        <left>0</left>
        <bottom>0</bottom>
        <right>0</right>
      </padding>
      <layers>
        <image>
          <anchor>CENTER</anchor>
          <fill>BOTH</fill>
          <width>0</width>
          <height>0</height>
          <padding>
            <top>0</top>
            <left>0</left>
            <bottom>0</bottom>
            <right>0</right>
          </padding>
          <file>label.png</file>
          <border>
            <top>16</top>
            <left>16</left>
            <bottom>16</bottom>
            <right>16</right>
          </border>
        </image>
        <text>
          <anchor>CENTER</anchor>
          <fill>NONE</fill>
          <width>0</width>
          <height>0</height>
          <padding>
            <top>4</top>
            <left>8</left>
            <bottom>4</bottom>
            <right>8</right>
          </padding>
          <binding>name</binding>
          <alignment>CENTER</alignment>
          <font>
            <name>Arial</name>
            <style>0</style>
            <size>14</size>
          </font>
          <color>
            <red>0</red>
            <green>0</green>
            <blue>0</blue>
          </color>
          <antialiased>true</antialiased>
        </text>
      </layers>
      <name>label</name>
    </style>
    <style>
      <anchor>CENTER</anchor>
      <fill>NONE</fill>
      <width>0</width>
      <height>0</height>
      <padding>
        <top>0</top>
        <left>0</left>
        <bottom>0</bottom>
        <right>0</right>
      </padding>
      <layers>
        <button>
          <anchor>CENTER</anchor>
          <fill>BOTH</fill>
          <width>0</width>
          <height>0</height>
          <padding>
            <top>8</top>
            <left>8</left>
            <bottom>8</bottom>
            <right>8</right>
          </padding>
          <binding>active</binding>
          <layers>
            <composite>
              <anchor>CENTER</anchor>
              <fill>NONE</fill>
              <width>0</width>
              <height>0</height>
              <padding>
                <top>0</top>
                <left>0</left>
                <bottom>0</bottom>
                <right>0</right>
              </padding>
              <layers>
                <image>
                  <anchor>TOP</anchor>
                  <fill>NONE</fill>
                  <width>0</width>
                  <height>0</height>
                  <padding>
                    <top>0</top>
                    <left>0</left>
                    <bottom>0</bottom>
                    <right>0</right>
                  </padding>
                  <file>white0.png</file>
                  <border>
                    <top>0</top>
                    <left>0</left>
                    <bottom>0</bottom>
                    <right>0</right>
                  </border>
                </image>
                <text>
                  <anchor>TOP</anchor>
                  <fill>NONE</fill>
                  <width>66</width>
                  <height>48</height>
                  <padding>
                    <top>8</top>
                    <left>4</left>
                    <bottom>0</bottom>
                    <right>0</right>
                  </padding>
                  <binding>name</binding>
                  <alignment>CENTER</alignment>
                  <font>
                    <name>Arial</name>
                    <style>1</style>
                    <size>12</size>
                  </font>
                  <color>
                    <red>0</red>
                    <green>0</green>
                    <blue>0</blue>
                  </color>
                  <antialiased>true</antialiased>
                </text>
              </layers>
            </composite>
            <composite>
              <anchor>CENTER</anchor>
              <fill>NONE</fill>
              <width>0</width>
              <height>0</height>
              <padding>
                <top>0</top>
                <left>0</left>
                <bottom>0</bottom>
                <right>0</right>
              </padding>
              <layers>
                <image>
                  <anchor>TOP</anchor>
                  <fill>NONE</fill>
                  <width>0</width>
                  <height>0</height>
                  <padding>
                    <top>0</top>
                    <left>0</left>
                    <bottom>0</bottom>
                    <right>0</right>
                  </padding>
                  <file>white1.png</file>
                  <border>
                    <top>0</top>
                    <left>0</left>
                    <bottom>0</bottom>
                    <right>0</right>
                  </border>
                </image>
                <text>
                  <anchor>TOP</anchor>
                  <fill>NONE</fill>
                  <width>66</width>
                  <height>48</height>
                  <padding>
                    <top>25</top>
                    <left>4</left>
                    <bottom>0</bottom>
                    <right>0</right>
                  </padding>
                  <binding>name</binding>
                  <alignment>CENTER</alignment>
                  <font>
                    <name>Arial</name>
                    <style>1</style>
                    <size>12</size>
                  </font>
                  <color>
                    <red>50</red>
                    <green>50</green>
                    <blue>50</blue>
                  </color>
                  <antialiased>true</antialiased>
                </text>
              </layers>
            </composite>
          </layers>
        </button>
      </layers>
      <name>white</name>
    </style>
    <style>
      <anchor>CENTER</anchor>
      <fill>NONE</fill>
      <width>0</width>
      <height>0</height>
      <padding>
        <top>0</top>
        <left>0</left>
        <bottom>0</bottom>
        <right>0</right>
      </padding>
      <layers>
        <button>
          <anchor>CENTER</anchor>
          <fill>BOTH</fill>
          <width>0</width>
          <height>0</height>
          <padding>
            <top>8</top>
            <left>8</left>
            <bottom>8</bottom>
            <right>8</right>
          </padding>
          <binding>active</binding>
          <layers>
            <composite>
              <anchor>CENTER</anchor>
              <fill>NONE</fill>
              <width>0</width>
              <height>0</height>
              <padding>
                <top>0</top>
                <left>0</left>
                <bottom>0</bottom>
                <right>0</right>
              </padding>
              <layers>
                <image>
                  <anchor>TOP</anchor>
                  <fill>NONE</fill>
                  <width>0</width>
                  <height>0</height>
                  <padding>
                    <top>0</top>
                    <left>0</left>
                    <bottom>0</bottom>
                    <right>0</right>
                  </padding>
                  <file>red0.png</file>
                  <border>
                    <top>0</top>
                    <left>0</left>
                    <bottom>0</bottom>
                    <right>0</right>
                  </border>
                </image>
                <text>
                  <anchor>TOP</anchor>
                  <fill>NONE</fill>
                  <width>66</width>
                  <height>48</height>
                  <padding>
                    <top>8</top>
                    <left>4</left>
                    <bottom>0</bottom>
                    <right>0</right>
                  </padding>
                  <binding>name</binding>
                  <alignment>CENTER</alignment>
                  <font>
                    <name>Arial</name>
                    <style>1</style>
                    <size>12</size>
                  </font>
                  <color>
                    <red>0</red>
                    <green>0</green>
                    <blue>0</blue>
                  </color>
                  <antialiased>true</antialiased>
                </text>
              </layers>
            </composite>
            <composite>
              <anchor>CENTER</anchor>
              <fill>NONE</fill>
              <width>0</width>
              <height>0</height>
              <padding>
                <top>0</top>
                <left>0</left>
                <bottom>0</bottom>
                <right>0</right>
              </padding>
              <layers>
                <image>
                  <anchor>TOP</anchor>
                  <fill>NONE</fill>
                  <width>0</width>